<?xml version="1.0" encoding="UTF-8"?>
<flowers xmlns:xsi="http://www.w3.org/2001/XMLSchema-instance"
         xmlns="urn:com.kotov.greenhouse"
         xsi:schemaLocation="urn:com.kotov.greenhouse ../schema/testSchema.xsd">

    <cut-flower vendor-code="A00001" planting-date="2020-02-01" cut-date="2021-04-27">
        <title>Rosa Aida @</title>
        <origin>Europe</origin>
        <petal-color>pink</petal-color>
        <stem-length>70</stem-length>
        <bud-state>open</bud-state>
    </cut-flower>
    <cut-flower vendor-code="A00002" planting-date="2020-05-10" cut-date="2021-04-27" leaves="false">
        <title>Rosa Duftwolke </title>
        <origin>Europe</origin>
        <petal-color>red</petal-color>
        <stem-length>72</stem-length>
        <bud-state>half_open</bud-state>
    </cut-flower>
    <cut-flower vendor-code="A00003" planting-date="2019-07-09" cut-date="2021-04-27">
        <title>Rosa Captain Harry Stebbings</title>
        <origin>North_America</origin>
        <petal-color>red</petal-color>
        <stem-length>60</stem-length>
        <bud-state>open</bud-state>
    </cut-flower>
    <cut-flower vendor-code="A00004" planting-date="2020-07-25" cut-date="2021-04-27" leaves="false">
        <title>Rosa Miss All American Beauty</title>
        <origin>North_America</origin>
        <petal-color>white</petal-color>
        <stem-length>75</stem-length>
        <bud-state>closed</bud-state>
    </cut-flower>
    <cut-flower vendor-code="A00005" planting-date="2019-03-25" cut-date="2021-04-27" leaves="false">
        <title>Tulip Yellow Jewel</title>
        <origin>Europe</origin>
        <petal-color>yellow</petal-color>
        <stem-length>60</stem-length>
        <bud-state>closed</bud-state>
    </cut-flower>
    <cut-flower vendor-code="A00006" planting-date="2020-05-03" cut-date="2021-04-27">
        <title>Tulip Cape Town</title>
        <origin>Europe</origin>
        <petal-color>yellow</petal-color>
        <stem-length>50</stem-length>
        <bud-state>half_open</bud-state>
    </cut-flower>
    <cut-flower vendor-code="A00007" planting-date="2020-07-06" cut-date="2021-04-27" leaves="false">
        <title>Lily Cassandra</title>
        <origin>Asia</origin>
        <petal-color>white</petal-color>
        <stem-length>40</stem-length>
        <bud-state>open</bud-state>
    </cut-flower>
    <cut-flower vendor-code="A00008" planting-date="2020-08-10" cut-date="2021-04-27">
        <title>Lily Dizzy</title>
        <origin>Europe</origin>
        <petal-color>pink</petal-color>
        <stem-length>60</stem-length>
        <bud-state>closed</bud-state>
    </cut-flower>
    <indoor-flower vendor-code="B00001" planting-date="2017-01-10">
        <title>Anigozanthos</title>
        <origin>Australia</origin>
        <petal-color>red</petal-color>
        <pot-type>solid</pot-type>
        <soil>turf</soil>
        <watering>1200</watering>
        <average-temperature>25</average-temperature>
        <photophilous>true</photophilous>
        <multiplying>seed</multiplying>
    </indoor-flower>
    <indoor-flower vendor-code="B00002" planting-date="2016-12-30">
        <title>Hippeastrum</title>
        <origin>South_America</origin>
        <petal-color>pink</petal-color>
        <pot-type>drainage</pot-type>
        <soil>humus</soil>
        <watering>750</watering>
        <average-temperature>22</average-temperature>
        <photophilous>true</photophilous>
        <multiplying>seed</multiplying>
    </indoor-flower>
    <indoor-flower vendor-code="B00003" planting-date="2017-06-08">
        <title>Viola odorata</title>
        <origin>Asia</origin>
        <petal-color>blue</petal-color>
        <pot-type>solid</pot-type>
        <soil>soddy-podzolic</soil>
        <watering>350</watering>
        <average-temperature>21</average-temperature>
        <photophilous>false</photophilous>
        <multiplying>leaf</multiplying>
    </indoor-flower>
    <indoor-flower vendor-code="B00004" planting-date="2018-11-21">
        <title>Hypoestes</title>
        <origin>Africa</origin>
        <petal-color>blue</petal-color>
        <pot-type>pot-holder</pot-type>
        <soil>soddy-podzolic</soil>
        <watering>650</watering>
        <average-temperature>25</average-temperature>
        <photophilous>true</photophilous>
        <multiplying>seed</multiplying>
    </indoor-flower>
    <indoor-flower vendor-code="B00005" planting-date="2015-05-05">
        <title>Adenium</title>
        <origin>Africa</origin>
        <petal-color>red</petal-color>
        <pot-type>drainage</pot-type>
        <soil>soddy-podzolic</soil>
        <watering>500</watering>
        <average-temperature>25</average-temperature>
        <photophilous>true</photophilous>
        <multiplying>cutting</multiplying>
    </indoor-flower>
    <indoor-flower vendor-code="B00006" planting-date="2016-01-28">
        <title>Calla</title>
        <origin>Africa</origin>
        <petal-color>white</petal-color>
        <pot-type>drainage</pot-type>
        <soil>turf</soil>
        <watering>300</watering>
        <average-temperature>26</average-temperature>
        <photophilous>true</photophilous>
        <multiplying>seed</multiplying>
    </indoor-flower>
    <indoor-flower vendor-code="B00007" planting-date="2021-03-10">
        <title>Lantana</title>
        <origin>South_America</origin>
        <petal-color>yellow</petal-color>
        <pot-type>pot-holder</pot-type>
        <soil>humus</soil>
        <watering>450</watering>
        <average-temperature>23</average-temperature>
        <photophilous>false</photophilous>
        <multiplying>leaf</multiplying>
    </indoor-flower>
    <indoor-flower vendor-code="B00008" planting-date="2020-04-13">
        <title>Thunbergia</title>
        <origin>Africa</origin>
        <petal-color>white</petal-color>
        <pot-type>solid</pot-type>
        <soil>turf</soil>
        <watering>800</watering>
        <average-temperature>24</average-temperature>
        <photophilous>true</photophilous>
        <multiplying>cutting</multiplying>
    </indoor-flower>
</flowers>