<?xml version="1.0" encoding="UTF-8"?>
<flowers xmlns:xsi="http://www.w3.org/2001/XMLSchema-instance"
         xmlns="urn:com.kotov.greenhouse"
         xsi:schemaLocation="urn:com.kotov.greenhouse testSchema.xsd">

    <cut-flower vendor-code="A00001" planting-date="2020-02-01" cut-date="2021-04-27">
        <title>Rosa Aida</title>
        <origin>Europe</origin>
        <petal-color>pink</petal-color>
        <stem-length>70</stem-length>
        <bud-state>open</bud-state>
    </cut-flower>
    <cut-flower vendor-code="A00002" planting-date="2020-05-10" cut-date="2021-04-27" leaves="false">
        <title>Rosa Duftwolke</title>
        <origin>Europe</origin>
        <petal-color>red</petal-color>
        <stem-length>72</stem-length>
        <bud-state>half_open</bud-state>
    </cut-flower>
    <cut-flower vendor-code="A00003" planting-date="2019-07-09" cut-date="2021-04-27">
        <title>Rosa Captain Harry Stebbings</title>
        <origin>North_America</origin>
        <petal-color>red</petal-color>
        <stem-length>60</stem-length>
        <bud-state>open</bud-state>
    </cut-flower>
    <indoor-flower vendor-code="B00001" planting-date="2017-01-10">
        <title>Anigozanthos</title>
        <origin>Australia</origin>
        <petal-color>red</petal-color>
        <pot-type>solid</pot-type>
        <soil>turf</soil>
        <watering>1200</watering>
        <average-temperature>25</average-temperature>
        <photophilous>true</photophilous>
        <multiplying>seed</multiplying>
    </indoor-flower>
    <indoor-flower vendor-code="B00002" planting-date="2016-12-30">
        <title>Hippeastrum</title>
        <origin>South_America</origin>
        <petal-color>pink</petal-color>
        <pot-type>drainage</pot-type>
        <soil>humus</soil>
        <watering>750</watering>
        <average-temperature>22</average-temperature>
        <photophilous>true</photophilous>
        <multiplying>seed</multiplying>
    </indoor-flower>
    <indoor-flower vendor-code="B00003" planting-date="2017-06-08">
        <title>Viola odorata</title>
        <origin>Asia</origin>
        <petal-color>blue</petal-color>
        <pot-type>solid</pot-type>
        <soil>soddy-podzolic</soil>
        <watering>350</watering>
        <average-temperature>21</average-temperature>
        <photophilous>false</photophilous>
        <multiplying>leaf</multiplying>
    </indoor-flower>
</flowers>